,address,companyType,incorporated,industryCode
343,"55 Westburn Avenue, Keighley, England, BD22 6AL",Private limited Company,22-Jun-16,70229 - Management consultancy activities other than financial management
344,"2-6 Unit 1, Britannia Street, Leicester, England, LE1 3LE",Private limited Company,22-Jun-16,82990 - Other business support service activities not elsewhere classified
345,"1 Cricklade Street, Old Town, Swindon, Wiltshire, United Kingdom, SN1 3EY",Private limited Company,24-Jun-16,43999 - Other specialised construction activities not elsewhere classified
346,"Flat 1 Denham Road, Burgess Hill, England, RH15 9TH",Private limited Company,29-Jun-16,45200 - Maintenance and repair of motor vehicles
347,"21 Keeton Road, Peterborough, England, PE1 3JH",Private limited Company,7-Jul-16,41202 - Construction of domestic buildings
348,"BRIDGESTONES, 125-127 Union Street, Oldham, Lancashire, OL1 1TE",Private limited Company,18-Jul-16,43342 - Glazing
349,"8 Thurlow Court Lincoln, 8 Thurlow Court, Lincoln, England, LN2 4SA",Private limited Company,8-Aug-16,43999 - Other specialised construction activities not elsewhere classified
350,"37-38 Market Street, Ferryhill, County Durham, England, DL17 8JH",Private limited Company,8-Aug-16,45112 - Sale of used cars and light motor vehicles
351,"37 Woodside, Shadforth, Co. Durham, England, DH6 1LD",Private limited Company,9-Aug-16,81300 - Landscape service activities
352,"5 Dunraven Court, Caerphilly, Wales, CF83 2UR",Private limited Company,18-Aug-16,96090 - Other service activities not elsewhere classified
353,"107 Great Cheetham Street West, Flat 3, Salford, England, M7 2JA",Private limited Company,22-Aug-16,43390 - Other building completion and finishing
354,"Saxon House, Saxon Way, Cheltenham, GL52 6QX",Private limited Company,27-Aug-16,82990 - Other business support service activities not elsewhere classified
355,"The White House, Old Perry Street, Chislehurst, Kent, BR7 6PL",Private limited Company,1-Sep-16,42120 - Construction of railways and underground railways
356,"40 Dorset Street, Chaddesden, Derby, Derbyshire, United Kingdom, DE21 6BE",Private limited Company,7-Sep-16,"87200 - Residential care activities for learning difficulties, mental health and substance abuse"
357,"Artic Lodge The Barracks, Gorefield, Wisbech, England, PE13 4PQ",Private limited Company,12-Sep-16,96090 - Other service activities not elsewhere classified
358,"The Stables Shipton Bridge Farm, Widdington, Saffron Walden, England, CB11 3SU",Private limited Company,19-Sep-16,93199 - Other sports activities
359,"3 St. Teilo Court, Undy, Caldicot, United Kingdom, NP26 3PQ",Private limited Company,26-Sep-16,87900 - Other residential care activities not elsewhere classified
360,"58 New Bedford Road, Luton, England, LU1 1SH",Private limited Company,28-Sep-16,52243 - Cargo handling for land transport activities
361,"7 Dunlop Close, Essex, Tilbury, United Kingdom, RM18 7BQ",Private limited Company,13-Oct-16,49320 - Taxi operation
362,"Unit 18 Wirral Business Park, Dock Road, Birkenhead, Merseyside, England, CH41 1JW",Private limited Company,17-Oct-16,96090 - Other service activities not elsewhere classified
363,"17 Robinsons Grove Hibaldstow, Brigg, United Kingdom, DN20 9QB",Private limited Company,19-Oct-16,49410 - Freight transport by road
364,"Brunel House 340 Firecrest Court, Centre Park, Warrington, United Kingdom, WA1 1RG",Private limited Company,21-Oct-16,71129 - Other engineering activities
365,"16-20 Long Barn Lane, Reading, England, RG2 7SZ",Private limited Company,28-Oct-16,45200 - Maintenance and repair of motor vehicles
366,"7 Aldham House, Malpas Road, London, England, SE4 1DP",Private limited Company,15-Nov-16,70229 - Management consultancy activities other than financial management
367,"Albany House, Claremont Lane, Esher, Surrey, KT10 9FQ",Private limited Company,22-Nov-16,47890 - Retail sale via stalls and markets of other goods
368,"23 De La Hay Avenue, Plymouth, England, PL3 4HS",Private limited Company,1-Dec-16,82990 - Other business support service activities not elsewhere classified
369,"49 Alamein Avenue, Chatham, Kent, England, ME5 0HZ",Private limited Company,8-Dec-16,49410 - Freight transport by road
370,"5 Fraser Gardens, Chibolton Avenue, Winchester, United Kingdom, SO22 5GB",Private limited Company,9-Jan-17,62012 - Business and domestic software development
371,"Bushbury House, 435 Wilmslow Road, Manchester, England, M20 4AF",Private limited Company,16-Jan-17,41100 - Development of building projects
372,"565 High Road Leytonstone, Leytonstone, London, E11 4PB",Private limited Company,17-Jan-17,"46390 - Non-specialised wholesale of food, beverages and tobacco"
373,"47a Prideaux Road, Eastbourne, England, BN21 2NB",Private limited Company,1-Feb-17,43999 - Other specialised construction activities not elsewhere classified
374,"10 Bunkers Hill, Kidlington, Oxon, United Kingdom, OX5 3BA",Private limited Company,6-Feb-17,70229 - Management consultancy activities other than financial management
375,"170 Pooltown Road, Ellesmere Port, Cheshire, United Kingdom, CH65 7BY",Private limited Company,9-Feb-17,"43220 - Plumbing, heat and air-conditioning installation"
376,"3 Dariel Close, Slough, England, SL1 5FH",Private limited Company,15-Feb-17,62020 - Information technology consultancy activities
377,"6 Peel Avenue, Tuxford, Newark, Nottinghamshire, England, NG22 0LY",Private limited Company,1-Mar-17,70229 - Management consultancy activities other than financial management
378,"The Wenta Business Centre, Suite 66, Electric Avenue, Enfield, Middlesex, United Kingdom, EN3 7XU",Private limited Company,3-Mar-17,96020 - Hairdressing and other beauty treatment
379,"Flat 70 Church Street, Weybridge, England, KT13 8DL",Private limited Company,8-Mar-17,49410 - Freight transport by road
380,"28 Magnolia Street, West Drayton, Middlesex, England, UB7 7UL",Private limited Company,14-Mar-17,62090 - Other information technology service activities
381,"3 Field Court, Gray's Inn, London, WC1R 5EF",Private limited Company,16-Mar-17,56102 - Unlicensed restaurants and cafes
382,"838 Wickham Road, Croydon, Surrey, United Kingdom, CR0 8ED",Private limited Company,27-Mar-17,56103 - Take-away food shops and mobile food stands
383,"2nd Floor. Katherine House, 11 Wyllyotts Place, Potters Bar, Hertfordshire, England, EN6 2JD",Private limited Company,27-Mar-17,49410 - Freight transport by road
384,"76 Spring Lane South Norwood, London, London, England, SE25 4SP",Private limited Company,27-Mar-17,86900 - Other human health activities
385,"99 Malthouse Green, Wigmore Park, Luton, United Kingdom, LU2 8SW",Private limited Company,13-Apr-17,41100 - Development of building projects
386,"9 Bowness Drive, Worcester, Worcestershire, United Kingdom, WR4 9HP",Private limited Company,18-Apr-17,47290 - Other retail sale of food in specialised stores
387,"20 High Street Lakenheath, Brandon, England, IP27 9JS",Private limited Company,2-May-17,56101 - Licensed restaurants
388,"69 Portnall Road, London, United Kingdom, W9 3BB",Private limited Company,2-May-17,10821 - Manufacture of cocoa and chocolate confectionery
389,"11 Holden Avenue, Bolton, United Kingdom, BL1 7EY",Private limited Company,2-May-17,"46160 - Agents involved in the sale of textiles, clothing, fur, footwear and leather goods"
390,"2a Smithywell Close, Trowbridge, England, BA14 7DP",Private limited Company,5-May-17,96090 - Other service activities not elsewhere classified
391,"56 Leaford Crescent, Watford, England, WD24 5JG",Private limited Company,17-May-17,85590 - Other education not elsewhere classified
392,"286b Chase Road, Southgate, London, United Kingdom, N14 6HF",Private limited Company,30-May-17,52243 - Cargo handling for land transport activities
393,"2 Vernon Way, Banbury, United Kingdom, OX16 1GF",Private limited Company,30-May-17,69201 - Accounting and auditing activities
394,"Unit 8 Old Ipswich Road, Ardleigh, Colchester, Essex, United Kingdom, CO7 7FX",Private limited Company,2-Jun-17,41201 - Construction of commercial buildings
395,"10 Gloucester Court Kew Road, Richmond, England, TW9 3EB",Private limited Company,5-Jun-17,41100 - Development of building projects
396,"Unit 5 Standfast Complex, Caton Road, Lancaster, Lancashire, United Kingdom, LA1 3PE",Private limited Company,9-Jun-17,"74909 - Other professional, scientific and technical activities not elsewhere classified"
397,"87 Station Road, Ashington, Northumberland, England, NE63 8RS",Private limited Company,13-Jun-17,"74909 - Other professional, scientific and technical activities not elsewhere classified"
398,"162-164 High Street, Rayleigh, Essex, United Kingdom, SS6 7BS",Private limited Company,28-Jun-17,70229 - Management consultancy activities other than financial management
399,"Adelaide, Upper Street, Kingsdown, Deal, Kent, United Kingdom, CT14 8DR",Private limited Company,11-Jul-17,43320 - Joinery installation
400,"Onward Chambers, 34 Market Street, Hyde, Cheshire, United Kingdom, SK14 1AH",Private limited Company,14-Jul-17,"43220 - Plumbing, heat and air-conditioning installation"
401,"38 Hinckley Road, Walsgrave On Sowe, Coventry, England, CV2 2EX",Private limited Company,20-Jul-17,"78101 - Motion picture, television and other theatrical casting activities"
402,"40 Centenary Business Centre, Hammond Close, Nuneaton, Warwickshire, England, CV11 6RY",Private limited Company,24-Jul-17,86900 - Other human health activities
403,"36 Little John Crescent, Wakefield, England, WF2 8RZ",Private limited Company,25-Jul-17,49390 - Other passenger land transport
404,"25 Balham High Road, London, England, SW12 9AL",Private limited Company,25-Jul-17,47250 - Retail sale of beverages in specialised stores
405,"The Turnpike Farm Business Centre London Road, Suton, Wymondham, Norfolk, United Kingdom, NR18 9SS",Private limited Company,26-Jul-17,56101 - Licensed restaurants
406,"199 Southborough Lane, Bromley, Kent, United Kingdom, BR2 8AR",Private limited Company,2-Aug-17,68100 - Buying and selling of own real estate
407,"36 Coychurch Road, Bridgend, Wales, CF31 3AP",Private limited Company,2-Aug-17,41100 - Development of building projects
408,"10a High Street, Chislehurst, Kent, England, BR7 5AN",Private limited Company,3-Aug-17,47910 - Retail sale via mail order houses or via Internet
409,"RESOLVE ADVISORY LIMITED, 22 York Buildings Corner Of John Adam Street, London, WC2N 6JU",Private limited Company,7-Aug-17,56101 - Licensed restaurants
410,"2 Warwick Road, Newcastle Upon Tyne, United Kingdom, NE5 2BS",Private limited Company,11-Aug-17,41100 - Development of building projects
411,"18 College Street, Burnham-On-Sea, England, TA8 1AE",Private limited Company,11-Aug-17,68310 - Real estate agencies
412,"A&E Holding Services Ltd, Burnden House, Viking Street, Bolton, United Kingdom, BL3 2RR",Private limited Company,15-Aug-17,42110 - Construction of roads and motorways
413,"119 Westfield Lane, Wyke, Bradford, England, BD12 9LY",Private limited Company,21-Aug-17,49410 - Freight transport by road
414,"Duffryn Villa, Woodfield Terrace, Mountain Ash, Wales, CF45 3UT",Private limited Company,22-Aug-17,81229 - Other building and industrial cleaning activities
415,"89-90 Meriden Street, Birmingham, United Kingdom, B5 5LR",Private limited Company,7-Sep-17,56290 - Other food services
416,"Unit 6 Heritage Business Centre, Derby Road, Belper, Derbyshire, England, DE56 1SW",Private limited Company,16-Oct-17,68209 - Other letting and operating of own or leased real estate
417,"Jamesons Hall Foundry Road, Morriston, Swansea, Wales, SA6 8DU",Private limited Company,17-Oct-17,45200 - Maintenance and repair of motor vehicles
418,"C/O Leonard Curtis 6th Floor Walker House, Exchange Flags, Liverpool, Merseyside, L2 3YL",Private limited Company,19-Oct-17,81210 - General cleaning of buildings
419,"18 Silver Street, Enfield, Middx, United Kingdom, EN1 3EG",Private limited Company,3-Nov-17,43110 - Demolition
420,"Natwest Chambers, 143-146 High Street, Cradley Heath, West Midlands, England, B64 5HJ",Private limited Company,9-Nov-17,56102 - Unlicensed restaurants and cafes
421,"19 Knockhill Gardens, Wolverhampton, England, WV10 6FG",Private limited Company,15-Nov-17,49410 - Freight transport by road
422,"188-189 Horninglow Street, Burton-On-Trent, Staffordshire, United Kingdom, DE14 1NG",Private limited Company,15-Nov-17,56101 - Licensed restaurants
423,"2 Old Bath Road, Newbury, England, RG14 1QL",Private limited Company,16-Nov-17,96090 - Other service activities not elsewhere classified
424,"975 Lincoln Road, Peterborough, England, PE4 6AF",Private limited Company,16-Nov-17,71129 - Other engineering activities
425,"85 Great Portland Street, First Floor, London, England, W1W 7LT",Private limited Company,17-Nov-17,"63110 - Data processing, hosting and related activities"
426,"68 Balfour Road, Derby, Derbyshire, England, DE23 8UN",Private limited Company,22-Nov-17,41202 - Construction of domestic buildings
427,"Stirling House Denny End Road, Waterbeach, Cambridge, Cambridgeshire, England, CB25 9PB",Private limited Company,23-Nov-17,33160 - Repair and maintenance of aircraft and spacecraft
428,"85 Great Portland Street, First Floor, London, England, W1W 7LT",Private limited Company,30-Nov-17,82990 - Other business support service activities not elsewhere classified
429,"1 Exeter Gardens, Wolverhampton, United Kingdom, WV2 2RE",Private limited Company,4-Dec-17,82990 - Other business support service activities not elsewhere classified
430,"18 Savile Row Savile Row, London, England, W1S 3PW",Private limited Company,12-Dec-17,82990 - Other business support service activities not elsewhere classified
431,"20 Cow Green, Halifax, England, HX1 1HX",Private limited Company,20-Dec-17,64999 - Financial intermediation not elsewhere classified
432,"Unit29 Vastre Industrial Estate, Newtown, Powys, Wales, SY16 1DZ",Private limited Company,21-Dec-17,47791 - Retail sale of antiques including antique books in stores
433,"2 Euston Road, Crossgates, Leeds, United Kingdom, LS15 8GA",Private limited Company,27-Dec-17,70221 - Financial management
434,"36 Southernhay, Basildon, Essex, United Kingdom, SS14 1ET",Private limited Company,3-Jan-18,43290 - Other construction installation
435,"C/O Parkins Accountants Bawtry Road, Wickersley, Rotherham, England, S66 2BL",Private limited Company,15-Jan-18,49410 - Freight transport by road
436,"13 Withern Road, Broxtowe, Nottingham, Nottinghamshire, NG8 6FG",Private limited Company,18-Jan-18,46760 - Wholesale of other intermediate products
437,"7 Rhiw Las, Brackla, Bridgend, United Kingdom, CF31 2LE",Private limited Company,19-Jan-18,46690 - Wholesale of other machinery and equipment
438,"Summit House, Horsecroft Road, Harlow, Essex, England, CM19 5BN",Private limited Company,19-Jan-18,43290 - Other construction installation
439,"541 Princess Road, Manchester, England, M20 1HA",Private limited Company,29-Jan-18,86900 - Other human health activities
440,"741 Stockport Road, Levenshulme/ Manchester, England, M19 3AR",Private limited Company,30-Jan-18,64205 - Activities of financial services holding companies
441,"53 Gauntlett Court, Wembley, England, HA0 2PQ",Private limited Company,30-Jan-18,38210 - Treatment and disposal of non-hazardous waste
442,"139 Harlow Crescent, Oxley Park, Milton Keynes, Buckinghamshire, England, MK4 4EP",Private limited Company,6-Feb-18,82990 - Other business support service activities not elsewhere classified
443,"24 Church View, Chippenham, United Kingdom, SN15 1QH",Private limited Company,12-Feb-18,69201 - Accounting and auditing activities
444,"52 Collingwood Gardens, Brooklands, Milton Keynes, Buckinghamshire, United Kingdom, MK10 7FP",Private limited Company,22-Feb-18,62020 - Information technology consultancy activities
445,"C/O Rawi & Co, 128 Ebury Street, London, United Kingdom, SW1W 9QQ",Private limited Company,5-Mar-18,56290 - Other food services
446,"31 Occupation Street, Dudley, United Kingdom, DY1 2RF",Private limited Company,5-Mar-18,43120 - Site preparation
447,"5 Ivegate, Yeadon, Leeds, United Kingdom, LS19 7RE",Private limited Company,8-Mar-18,78300 - Human resources provision and management of human resources functions
448,"Unit 3&4 155-157 Cheetham Hill Road, Manchester, England, M8 8LY",Private limited Company,9-Mar-18,46420 - Wholesale of clothing and footwear
449,"Flat 55 Garner Court, Dunlop Road, Tilbury, England, RM18 7BG",Private limited Company,15-Mar-18,49410 - Freight transport by road
450,"18 Foster Close, Whiston, Prescot, United Kingdom, L35 7NW",Private limited Company,20-Mar-18,77110 - Renting and leasing of cars and light motor vehicles
451,"19 Richards Field, Basingstoke, United Kingdom, RG24 8JY",Private limited Company,22-Mar-18,96090 - Other service activities not elsewhere classified
452,"PO Box 4385, 11287813: COMPANIES HOUSE DEFAULT ADDRESS, Cardiff, CF14 8LH",Private limited Company,3-Apr-18,81222 - Specialised cleaning services
453,"11 Kalman Gardens, Milton Keynes, United Kingdom, MK7 8QH",Private limited Company,3-Apr-18,43330 - Floor and wall covering
454,"2 Pineholt Close, St. Ives, Ringwood, England, BH24 2NE",Private limited Company,4-Apr-18,38110 - Collection of non-hazardous waste
455,"Kefco Pro, 25 Wilton Rd, London, England, SW1V 1LW",Private limited Company,5-Apr-18,49410 - Freight transport by road
456,"129 Philip Street, Eccles, Manchester, England, M30 0NF",Private limited Company,5-Apr-18,38110 - Collection of non-hazardous waste
457,"26 Foxlea Gardens, Gosport, United Kingdom, PO12 4JD",Private limited Company,9-Apr-18,43999 - Other specialised construction activities not elsewhere classified
458,"35 Feoffees Road, Somersham, Huntingdon, United Kingdom, PE28 3JE",Private limited Company,9-Apr-18,25110 - Manufacture of metal structures and parts of structures
459,"23 Memorial Road, Worsley, Manchester, Lancashire, United Kingdom, M28 3AG",Private limited Company,10-Apr-18,96090 - Other service activities not elsewhere classified
460,"24 Hambleton View, Tollerton, York, United Kingdom, YO61 1QW",Private limited Company,12-Apr-18,96090 - Other service activities not elsewhere classified
461,"15-19 Greenhill Crescent, Watford, Hertfordshire, England, WD18 8PH",Private limited Company,17-Apr-18,41202 - Construction of domestic buildings
462,"2 Ridge Crescent, Whitefield, Manchester, England, M45 8FN",Private limited Company,17-Apr-18,33110 - Repair of fabricated metal products
463,"27-29 Nicholson Road, Flat 3a, Croydon, United Kingdom, CR0 6QT",Private limited Company,19-Apr-18,47910 - Retail sale via mail order houses or via Internet
464,"26 Cromwell Road Cromwell Road, Hayes, United Kingdom, UB3 2PP",Private limited Company,25-Apr-18,"43220 - Plumbing, heat and air-conditioning installation"
465,"48 Grafton Avenue, Rochester, Kent, United Kingdom, ME1 2RP",Private limited Company,27-Apr-18,43991 - Scaffold erection
466,"7 Prout Grove, London, England, NW10 1PU",Private limited Company,30-Apr-18,41201 - Construction of commercial buildings
467,"12 Melford Close, Luton, United Kingdom, LU2 9SN",Private limited Company,1-May-18,43390 - Other building completion and finishing
468,"16 Astins House The Drive, London, United Kingdom, E17 3BP",Private limited Company,8-May-18,49410 - Freight transport by road
469,"Mansion House, Manchester Road, Altrincham, Cheshire, England, WA14 4RW",Private limited Company,9-May-18,82990 - Other business support service activities not elsewhere classified
470,"Laneside Palmer Street, South Hetton, Durham, United Kingdom, DH6 2SU",Private limited Company,11-May-18,47890 - Retail sale via stalls and markets of other goods
471,"19 Norfolk Street, Sunderland, England, SR1 1EA",Private limited Company,11-May-18,41100 - Development of building projects
472,"14 Nursery Road, Urmston, Manchester, England, M41 7NP",Private limited Company,14-May-18,84240 - Public order and safety activities
473,"Suite 1 Aireside House, Royd Ings Avenue, Keighley, West Yorkshire, England, BD21 4BZ",Private limited Company,15-May-18,82110 - Combined office administrative service activities
474,"9 Fitzgerald Court Clinton Park, Tattershall, Lincoln, England, LN4 4PU",Private limited Company,16-May-18,25990 - Manufacture of other fabricated metal products not elsewhere classified
475,"17 Bridgegate, Howden, England, DN14 7AE",Private limited Company,21-May-18,"47990 - Other retail sale not in stores, stalls or markets"
476,"130 Old Street, London, England, EC1V 9BD",Private limited Company,22-May-18,41201 - Construction of commercial buildings
477,"27 Old Gloucester Street, London, United Kingdom, WC1N 3AX",Private limited Company,22-May-18,68100 - Buying and selling of own real estate
478,"167 Belgrave Gate, Leicester, United Kingdom, LE1 3HS",Private limited Company,25-May-18,56101 - Licensed restaurants
479,"10 Broadheath Close, Droitwich, Worcestershire, England, WR9 7SW",Private limited Company,26-May-18,49410 - Freight transport by road
480,"20-22 Wenlock Road, London, England, N1 7GU",Private limited Company,29-May-18,64205 - Activities of financial services holding companies
481,"45 East Crescent, Rotherham, United Kingdom, S65 2RT",Private limited Company,31-May-18,47910 - Retail sale via mail order houses or via Internet
482,"George Court, Bartholomews Walk, Ely, Cambridgeshire, United Kingdom, CB7 4JW",Private limited Company,1-Jun-18,68209 - Other letting and operating of own or leased real estate
483,"1 Ryegate Road, Sheffield, England, S10 5FA",Private limited Company,6-Jun-18,46190 - Agents involved in the sale of a variety of goods
484,"Flat 22, Grange Park Mews, Dib Lane, Leeds, United Kingdom, LS8 3HL",Private limited Company,7-Jun-18,86220 - Specialists medical practice activities
485,"32 Halford Close Halford Close, Edgware, United Kingdom, HA8 5QF",Private limited Company,11-Jun-18,59113 - Television programme production activities
486,"12 Snowdrop Avenue, Wynyard, Billingham, United Kingdom, TS22 5RA",Private limited Company,19-Jun-18,56103 - Take-away food shops and mobile food stands
487,"2 Marina Crescent, Huyton, Liverpool, Merseyside, United Kingdom, L36 5XL",Private limited Company,25-Jun-18,68100 - Buying and selling of own real estate
488,"Dexter & Sharpe (Lincoln) Ltd Landmark House, 1 Riseholme Road, Lincoln, Lincolnshire, England, LN1 3SN",Private limited Company,2-Jul-18,56101 - Licensed restaurants
489,"Henry John House Northway Trading Estate, Northway Lane, Tewkesbury, Gloucestershire, United Kingdom, GL20 8JH",Private limited Company,2-Jul-18,80100 - Private security activities
490,"Southfield Farm Hull Road, Wilberfoss, York, United Kingdom, YO41 5NT",Private limited Company,6-Jul-18,70229 - Management consultancy activities other than financial management
491,"19 Burnside Drive, Spondon, Derby, United Kingdom, DE21 7QR",Private limited Company,9-Jul-18,71129 - Other engineering activities
492,"6 Cary Road, London, England, E11 3LQ",Private limited Company,12-Jul-18,43310 - Plastering
493,"299a Bethnal Green Road, London, United Kingdom, E2 6AH",Private limited Company,20-Jul-18,63990 - Other information service activities not elsewhere classified
494,"243 London Road South, Lowestoft, England, NR33 0DS",Private limited Company,23-Jul-18,56103 - Take-away food shops and mobile food stands
495,"8 Cowper Road, Liverpool, United Kingdom, L13 5SP",Private limited Company,23-Jul-18,45112 - Sale of used cars and light motor vehicles
496,"Unit 1 Monks Pond Street, Northampton, United Kingdom, NN1 2LF",Private limited Company,25-Jul-18,46420 - Wholesale of clothing and footwear
497,"15c Balfour Road, Ilford, United Kingdom, IG1 4HP",Private limited Company,6-Aug-18,41202 - Construction of domestic buildings
498,"35a Church Lane, West Bromwich, West Midland, United Kingdom, B71 1DB",Private limited Company,6-Aug-18,"26513 - Manufacture of non-electronic measuring, testing etc. equipment, not for industrial process control"
499,"Office No 7 Unit 1 Lewis Road Ind. Estate, Radford Road, Nottingham, United Kingdom, NG7 7NQ",Private limited Company,7-Aug-18,46520 - Wholesale of electronic and telecommunications equipment and parts
500,"Hazeldene, Wheal Harmony, Redruth, England, TR15 1EE",Private limited Company,8-Aug-18,41201 - Construction of commercial buildings
501,"16 Squires Close, Rogerstone, Newport, Wales, NP10 0BW",Private limited Company,10-Aug-18,96090 - Other service activities not elsewhere classified
502,"210 Vicarage Road, Morriston, Swansea, United Kingdom, SA6 6DX",Private limited Company,21-Aug-18,70229 - Management consultancy activities other than financial management
503,"11 Meadowfields Close Crofton, Wakefield, West Yorkshire, England, WF4 1JF",Private limited Company,23-Aug-18,10390 - Other processing and preserving of fruit and vegetables
504,"83 Old Road Overton Wakefield 83, Old Road, Wakefield, West Yorkshire, England, WF4 4QX",Private limited Company,30-Aug-18,49410 - Freight transport by road
505,"C/O Hgv Driver Group 76 Market Street, Farnworth, Bolton, Lancashire, England, BL4 7NY",Private limited Company,1-Sep-18,49410 - Freight transport by road
506,"32 Council Villas Milestone Walk, Sling, Coleford, England, GL16 8JP",Private limited Company,4-Sep-18,49420 - Removal services
507,"13 Waxwing Way, Great Coates, Grimsby, United Kingdom, DN37 9HS",Private limited Company,5-Sep-18,09100 - Support activities for petroleum and natural gas extraction
508,"190 Billet Road, London, United Kingdom, E17 5DX",Private limited Company,6-Sep-18,96090 - Other service activities not elsewhere classified
509,"Lamb Inn Burley Road, Winkton, Christchurch, United Kingdom, BH23 7AN",Private limited Company,10-Sep-18,56302 - Public houses and bars
510,"Surchley House, Reddicap Trading Estate, Sutton Coldfield, England, B75 7BU",Private limited Company,12-Sep-18,41201 - Construction of commercial buildings
511,"14 Brook Dene, Winslow, Buckingham, United Kingdom, MK18 3FU",Private limited Company,13-Sep-18,43390 - Other building completion and finishing
