,address,companyType,incorporated,industryCode
512,"11 Barns Place, Hale Barns, Altrincham, United Kingdom, WA15 0HP",Private limited Company,14-Sep-18,68100 - Buying and selling of own real estate
513,"4 Marsh Lea, Diggle, Oldham, United Kingdom, OL3 5LB",Private limited Company,17-Sep-18,01290 - Growing of other perennial crops
514,"7 St Pauls Yard, Silver Street, Newport Pagnell, Bucks, England, MK16 0EG",Private limited Company,17-Sep-18,70229 - Management consultancy activities other than financial management
515,"5 Haselfoot Gardens Haselfoot Gardens, West End, Southampton, Hampshire, SO30 3DA",Private limited Company,25-Sep-18,86102 - Medical nursing home activities
516,"27 Gallosson Road, London, United Kingdom, SE18 1RD",Private limited Company,1-Oct-18,56290 - Other food services
517,"27 Old Gloucester Street, London, United Kingdom, WC1N 3AX",Private limited Company,2-Oct-18,63990 - Other information service activities not elsewhere classified
518,"9 Warren Road, Conisbrough, Doncaster, United Kingdom, DN12 2NF",Private limited Company,11-Oct-18,43120 - Site preparation
519,"45 Kingsway, Staines-Upon-Thames, Middlesex, United Kingdom, TW19 7QF",Private limited Company,11-Oct-18,41202 - Construction of domestic buildings
520,"50 Chelveston Crescent, Southampton, United Kingdom, SO16 5SA",Private limited Company,12-Oct-18,86101 - Hospital activities
521,"4 Highview MorganS Farm, Moor Hall Road, Harlow, England, CM17 0LP",Private limited Company,12-Oct-18,96090 - Other service activities not elsewhere classified
522,"57 Hedge Lane, London, United Kingdom, N13 5SJ",Private limited Company,16-Oct-18,53202 - Unlicensed carrier
523,"Grosvenor House, 22 Grafton Street, Altrincham, Cheshire, United Kingdom, WA14 1DU",Private limited Company,16-Oct-18,82990 - Other business support service activities not elsewhere classified
524,"European House, 93 Wellington Road, Leeds, West Yorkshire, England, LS12 1DZ",Private limited Company,19-Oct-18,82990 - Other business support service activities not elsewhere classified
525,"35 Battersea Road, Bristol, United Kingdom, BS5 6AJ",Private limited Company,26-Oct-18,98000 - Residents property management
526,"16 Cobden Street, Cross Keys, Newport, Gwent, Wales, NP11 7PF",Private limited Company,29-Oct-18,16230 - Manufacture of other builders' carpentry and joinery
527,"1 Winterbourne Road, Dagenham, United Kingdom, RM8 2JZ",Private limited Company,5-Nov-18,42220 - Construction of utility projects for electricity and telecommunications
528,"274 Cemetery Road, Bradford, United Kingdom, BD7 2PY",Private limited Company,8-Nov-18,78109 - Other activities of employment placement agencies
529,"10 Mansell Road, Shoreham-By-Sea, West Sussex, United Kingdom, BN43 6GQ",Private limited Company,9-Nov-18,43390 - Other building completion and finishing
530,"35 Canadian Avenue, Gillingham, Kent, England, ME7 2DW",Private limited Company,12-Nov-18,82990 - Other business support service activities not elsewhere classified
531,"Kemp House, 160 City Road, London, United Kingdom, EC1V 2NX",Private limited Company,12-Nov-18,71129 - Other engineering activities
532,"Mulberry House, Buntsford Park Road, Bromsgrove, United Kingdom, B60 3DX",Private limited Company,13-Nov-18,96090 - Other service activities not elsewhere classified
533,"Mortimer Group Chatsworth Parade, Petts Wood, Orpington, England, BR5 1DE",Private limited Company,15-Nov-18,85600 - Educational support services
534,"23 Moreland Avenue, Hereford, United Kingdom, HR1 1BL",Private limited Company,15-Nov-18,18130 - Pre-press and pre-media services
535,"20-22 Wenlock Road, London, England, N1 7GU",Private limited Company,15-Nov-18,43210 - Electrical installation
536,"18 Fountain Street, Ferndale, Wales, CF43 4SA",Private limited Company,16-Nov-18,82990 - Other business support service activities not elsewhere classified
537,"41 Central Drive Penwortham, Preston, England, PR1 0NL",Private limited Company,19-Nov-18,43290 - Other construction installation
538,"15 Elmhurst Road, Thatcham, United Kingdom, RG18 3DQ",Private limited Company,21-Nov-18,41202 - Construction of domestic buildings
539,"35 Longley Close Longley Close, Fulwood, Preston, United Kingdom, PR2 9TB",Private limited Company,22-Nov-18,10850 - Manufacture of prepared meals and dishes
540,"6 Winchester Road, Southampton, United Kingdom, SO16 6UL",Private limited Company,22-Nov-18,86900 - Other human health activities
541,"1 Golders Green Road, London, England, NW11 8DY",Private limited Company,23-Nov-18,73110 - Advertising agencies
542,"Brunel House 340 Firecrest Court, Centre Park, Warrington, Cheshire, United Kingdom, WA1 1RG",Private limited Company,23-Nov-18,71129 - Other engineering activities
543,"272a Dewsbury Road, Leeds, United Kingdom, LS11 6JT",Private limited Company,26-Nov-18,47710 - Retail sale of clothing in specialised stores
544,"573 Chester Road, Sutton Coldfield, United Kingdom, B73 5HU",Private limited Company,26-Nov-18,47290 - Other retail sale of food in specialised stores
545,"123 Harvey Drive, Chestfield, Whitstable, United Kingdom, CT5 3QY",Private limited Company,27-Nov-18,86900 - Other human health activities
546,"29 Flat Ritchie House Howland Estate, Moodkee Street, London, England, SE16 7BL",Private limited Company,27-Nov-18,46900 - Non-specialised wholesale trade
547,"196 High Road Wood Green, London, England, N22 8HH",Private limited Company,30-Nov-18,47782 - Retail sale by opticians
548,"27 Collegiate Way, Swinton, Manchester, United Kingdom, M27 4LA",Private limited Company,3-Dec-18,73120 - Media representation services
549,"Cranmore Drive Cranmore Drive, Shirley, Solihull, United Kingdom, B90 4RZ",Private limited Company,3-Dec-18,80200 - Security systems service activities
550,"26a Astwood Road, Worcester, England, WR3 8ET",Private limited Company,3-Dec-18,"52219 - Other service activities incidental to land transportation, not elsewhere classified"
551,"Flat 4, Brunswick Lodge, 11 Brunswick Hill, Reading, Berkshire, England, RG1 7YT",Private limited Company,5-Dec-18,82990 - Other business support service activities not elsewhere classified
552,"36 Moorcroft, Harlington Road, Uxbridge, United Kingdom, UB8 3HD",Private limited Company,7-Dec-18,69102 - Solicitors
553,"Penny Lane Business Centre, 374 Smithdown Road, Liverpool, Merseyside, England, L15 5AN",Private limited Company,7-Dec-18,88990 - Other social work activities without accommodation not elsewhere classified
554,"7 Ripon Road, Dewsbury, United Kingdom, WF12 7LF",Private limited Company,10-Dec-18,43341 - Painting
555,"124 Brancaster Lane, Purley, United Kingdom, CR8 1HH",Private limited Company,10-Dec-18,46190 - Agents involved in the sale of a variety of goods
556,"Mtm 3rd Floor, 82 King Street, Manchester, United Kingdom, M2 4WQ",Private limited Company,11-Dec-18,38110 - Collection of non-hazardous waste
557,"33 Garrick Avenue, London, United Kingdom, NW11 9AR",Private limited Company,12-Dec-18,56210 - Event catering activities
558,"142 Victoria Street, Glossop, United Kingdom, SK13 8JF",Private limited Company,13-Dec-18,56302 - Public houses and bars
559,"1 Lumley Road, Dewsbury, United Kingdom, WF12 7DU",Private limited Company,19-Dec-18,"46150 - Agents involved in the sale of furniture, household goods, hardware and ironmongery"
560,"Unit J2 Chamberlain Business Centre, Chamberlain Road, Hull, United Kingdom, HU8 8HL",Private limited Company,19-Dec-18,45200 - Maintenance and repair of motor vehicles
561,"20 Colman Crescent, Hull, England, HU8 8AN",Private limited Company,19-Dec-18,96090 - Other service activities not elsewhere classified
562,"1 Fisher Close, Brooksby's Walk, London, United Kingdom, E9 6DN",Private limited Company,19-Dec-18,98000 - Residents property management
563,"60 High Street, Banbury, United Kingdom, OX16 5JJ",Private limited Company,21-Dec-18,56103 - Take-away food shops and mobile food stands
564,"Spring Cottage Spring Cottage, 3 The Street, North Stoke, Wallingford, Oxon, United Kingdom, OX10 6BL",Private limited Company,27-Dec-18,70229 - Management consultancy activities other than financial management
565,"23 Calderon Road, Leyton, United Kingdom, E11 4ET",Private limited Company,28-Dec-18,41201 - Construction of commercial buildings
566,"12a Wortley Road, Leeds, United Kingdom, LS12 3HU",Private limited Company,28-Dec-18,81221 - Window cleaning services
567,"Appleton House, Appleton-Le-Moors, York, United Kingdom, YO62 6TE",Private limited Company,31-Dec-18,86210 - General medical practice activities
568,"13 Heathdene Drive, Belvedere, United Kingdom, DA17 6HY",Private limited Company,31-Dec-18,47910 - Retail sale via mail order houses or via Internet
569,"4/4a Bloomsbury Square, London, United Kingdom, WC1A 2RP",Private limited Company,2-Jan-19,"84120 - Regulation of health care, education, cultural and other social services, not incl. social security"
570,"69 Banks Street, Blackpool, England, FY1 2DT",Private limited Company,2-Jan-19,98000 - Residents property management
571,"18 Whaddon House Dog Kennel Hill Estate, London, United Kingdom, SE22 8AQ",Private limited Company,3-Jan-19,"46390 - Non-specialised wholesale of food, beverages and tobacco"
572,"5 West Marsh Close, Bolton, Lancashire, United Kingdom, BL1 2UZ",Private limited Company,4-Jan-19,56210 - Event catering activities
573,"106 Chaucer Road, Peterborough, United Kingdom, PE1 3LR",Private limited Company,7-Jan-19,68100 - Buying and selling of own real estate
574,"Flat 8 Chester House, Chester Road, Highgate, United Kingdom, N19 5DJ",Private limited Company,11-Jan-19,68100 - Buying and selling of own real estate
575,"68 Hazelhurst Brow Hazelhurst Brow, Bradford, West Yorkshire, United Kingdom, BD9 6AQ",Private limited Company,11-Jan-19,"46160 - Agents involved in the sale of textiles, clothing, fur, footwear and leather goods"
576,"16 Longroyd Farm, Middlestown, Wakefield, United Kingdom, WF4 4QB",Private limited Company,14-Jan-19,43320 - Joinery installation
577,"5 Tumblers Hill, Sutton Valence, Maidstone, Kent, ME17 3AE",Private limited Company,14-Jan-19,71200 - Technical testing and analysis
578,"45 Rosewall Road, Southampton, Hampshire, United Kingdom, SO16 5DU",Private limited Company,15-Jan-19,68209 - Other letting and operating of own or leased real estate
579,"483 Green Lanes, London, United Kingdom, N13 4BS",Private limited Company,15-Jan-19,77110 - Renting and leasing of cars and light motor vehicles
580,"632 Tyburn Road, Birmingham, United Kingdom, B24 9RP",Private limited Company,16-Jan-19,49410 - Freight transport by road
581,"22 Cromwell Avenue, Bromley South, London, United Kingdom, BR2 9AQ",Private limited Company,17-Jan-19,78109 - Other activities of employment placement agencies
582,"71 Green Lane Road, Leicester, United Kingdom, LE5 3TP",Private limited Company,17-Jan-19,14132 - Manufacture of other women's outerwear
583,"38 St Andrews Tower, Baird Avenue, Southall, England, UB1 3LX",Private limited Company,18-Jan-19,41202 - Construction of domestic buildings
584,"Kemp House, 160 City Road, London, United Kingdom, EC1V 2NX",Private limited Company,21-Jan-19,68100 - Buying and selling of own real estate
585,"Unit A, 233a Dunstable Road, Luton, Bedfordshire, England, LU4 8BN",Private limited Company,22-Jan-19,47750 - Retail sale of cosmetic and toilet articles in specialised stores
586,"148 Warren Road, Washwood Heath, Birmingham, United Kingdom, B8 2YQ",Private limited Company,23-Jan-19,41202 - Construction of domestic buildings
587,"20-22 Wenlock Road, London, England, N1 7GU",Private limited Company,24-Jan-19,81222 - Specialised cleaning services
588,"38 Springfield Road, Gillingham, Kent, England, ME7 1YJ",Private limited Company,28-Jan-19,68310 - Real estate agencies
589,"21 Nicholas Avenue, Old Marston, Oxford, United Kingdom, OX3 0RN",Private limited Company,28-Jan-19,43341 - Painting
590,"17 Eccleston Court, Maidstone, Kent, United Kingdom, ME15 6QZ",Private limited Company,29-Jan-19,46900 - Non-specialised wholesale trade
591,"967 Stockport Road, Levenshulme, Manchester, United Kingdom, United Kingdom, M19 3NP",Private limited Company,1-Feb-19,68100 - Buying and selling of own real estate
592,"85 Great Portland Street, London, W1W 7LT",Private limited Company,4-Feb-19,56302 - Public houses and bars
593,"52 Knowles Avenue, Crowthorne, United Kingdom, RG45 6DU",Private limited Company,6-Feb-19,47910 - Retail sale via mail order houses or via Internet
594,"14 Websters Close, Glinton, Peterborough, United Kingdom, PE6 7LQ",Private limited Company,7-Feb-19,45200 - Maintenance and repair of motor vehicles
595,"1 Kings Avenue, London, United Kingdom, N21 3NA",Private limited Company,7-Feb-19,68209 - Other letting and operating of own or leased real estate
596,"97 Hockwell Ring, Luton, Bedfordshire, England, LU4 9NJ",Private limited Company,8-Feb-19,49320 - Taxi operation
597,"53 Hickinwood Crescent, Clowne, Chesterfield, United Kingdom, S43 4AQ",Private limited Company,8-Feb-19,41202 - Construction of domestic buildings
598,"Craig House Flat 1, Hartington Road, London, United Kingdom, W13 8QJ",Private limited Company,11-Feb-19,45112 - Sale of used cars and light motor vehicles
599,"Pine Lodge, Lower Wokingham Road, Crowthorne, United Kingdom, RG45 6DB",Private limited Company,18-Feb-19,70221 - Financial management
600,"15 West Drive, Droylsden, Manchester, United Kingdom, M43 6PU",Private limited Company,20-Feb-19,43390 - Other building completion and finishing
601,"132 Silverdale Drive, Waterlooville, Hampshire, United Kingdom, PO7 6DX",Private limited Company,21-Feb-19,62020 - Information technology consultancy activities
602,"63-66 Hatton Garden, Fifth Floor, Suite 23, London, England, EC1N 8LE",Private limited Company,22-Feb-19,"46120 - Agents involved in the sale of fuels, ores, metals and industrial chemicals"
603,"55 Beanfield Avenue, Corby, United Kingdom, NN18 0EQ",Private limited Company,25-Feb-19,43310 - Plastering
604,"85 Codicote Road, Welwyn, England, AL6 9TY",Private limited Company,26-Feb-19,70229 - Management consultancy activities other than financial management
605,"14 Tolworth Rise South, Tolworth, Surrey, England, KT5 9NN",Private limited Company,1-Mar-19,56210 - Event catering activities
606,"19 East Parade, Harrogate, United Kingdom, HG1 5LF",Private limited Company,6-Mar-19,"01700 - Hunting, trapping and related service activities"
607,"20 Stanhope Heath, Stanwell, Staines-Upon-Thames, United Kingdom, TW19 7PH",Private limited Company,8-Mar-19,68100 - Buying and selling of own real estate
608,"34 Tall Ash Avenue, Congleton, United Kingdom, CW12 2DZ",Private limited Company,11-Mar-19,45200 - Maintenance and repair of motor vehicles
609,"9 Westwood Drive, Pendlebury, Manchester, United Kingdom, M27 4JJ",Private limited Company,13-Mar-19,49410 - Freight transport by road
610,"Unit 50046, 5 Percy Street, London, Fitzrovia, United Kingdom, W1T 1DG",Private limited Company,14-Mar-19,62011 - Ready-made interactive leisure and entertainment software development
611,"7 Russett Close, Aylesford, Kent, Surrey, United Kingdom, ME20 7PL",Private limited Company,15-Mar-19,86210 - General medical practice activities
612,"46 Brisbane Way, Cannock, United Kingdom, WS12 2GR",Private limited Company,15-Mar-19,70229 - Management consultancy activities other than financial management
613,"142 Milton Street, Maidstone, Kent, England, ME16 8LL",Private limited Company,18-Mar-19,49410 - Freight transport by road
614,"22 Woodlands Road, Harrow, Middlesex, United Kingdom, HA1 2RS",Private limited Company,18-Mar-19,41202 - Construction of domestic buildings
615,"39 Newmarket Street, Leicester, Leicestershire, United Kingdom, LE2 3WQ",Private limited Company,19-Mar-19,43320 - Joinery installation
616,"1 Royal Terrace, Southend On Sea, Essex, United Kingdom, SS1 1EA",Private limited Company,19-Mar-19,42990 - Construction of other civil engineering projects not elsewhere classified
617,"34 Clowne Road, Barlborough, Chesterfield, United Kingdom, S43 4EJ",Private limited Company,20-Mar-19,41100 - Development of building projects
618,"375 Kings Road, Stretford, Manchester, United Kingdom, M32 8GP",Private limited Company,21-Mar-19,68209 - Other letting and operating of own or leased real estate
619,"85 Hartfield Cescent, Wimbeldon, London, United Kingdom, SW19 3RZ",Private limited Company,23-Mar-19,52290 - Other transportation support activities
620,"32 Orwell Drive Orwell Drive, Birmingham, England, B38 8HZ",Private limited Company,26-Mar-19,56290 - Other food services
621,"PO Box 4385, 11913721: COMPANIES HOUSE DEFAULT ADDRESS, Cardiff, CF14 8LH",Private limited Company,29-Mar-19,43999 - Other specialised construction activities not elsewhere classified
622,"20-22 Wenlock Road, London, England, N1 7GU",Private limited Company,1-Apr-19,47290 - Other retail sale of food in specialised stores
623,"42 Hill Rise, Greenford, England, UB6 8PB",Private limited Company,2-Apr-19,"47820 - Retail sale via stalls and markets of textiles, clothing and footwear"
624,"28 Delamere Road, Reigate, Surrey, United Kingdom, RH2 7RB",Private limited Company,2-Apr-19,41100 - Development of building projects
625,"54 Bannockburn Road, London, England, SE18 1EP",Private limited Company,3-Apr-19,41202 - Construction of domestic buildings
626,"209 Bute Street, Cardiff, United Kingdom, CF10 5HR",Private limited Company,4-Apr-19,56103 - Take-away food shops and mobile food stands
627,"8 Redhurst Drive, Wolverhampton, West Midlands, United Kingdom, WV10 6QW",Private limited Company,4-Apr-19,43910 - Roofing activities
628,"71-75 Shelton Street, Covent Garden, London, England, WC2H 9JQ",Private limited Company,4-Apr-19,41100 - Development of building projects
629,"245a Bevington Road, Birmingham, England, B6 6HT",Private limited Company,5-Apr-19,68100 - Buying and selling of own real estate
630,"Court Villa, Court Street, Tonypandy, Rhondda Cynon Taff, Wales, CF40 2 RF",Private limited Company,8-Apr-19,41100 - Development of building projects
631,"134 2 Elmira Street, London, United Kingdom, SE13 7FQ",Private limited Company,8-Apr-19,69109 - Activities of patent and copyright agents; other legal activities not elsewhere classified
632,"25 Lambourne Road, Barking, England, IG11 9PR",Private limited Company,10-Apr-19,42120 - Construction of railways and underground railways
633,"53 Padstow Road, Birmingham, England, B24 0NH",Private limited Company,10-Apr-19,43210 - Electrical installation
634,"8 Malting Row, Honington, St. Edmunds, England, IP31 1RE",Private limited Company,12-Apr-19,68320 - Management of real estate on a fee or contract basis
635,"44 Gascoigne Road, Barking, United Kingdom, IG11 7LG",Private limited Company,16-Apr-19,96090 - Other service activities not elsewhere classified
636,"742 Bordesley Green Bordesley Green, Birmingham, United Kingdom, B9 5PQ",Private limited Company,17-Apr-19,41202 - Construction of domestic buildings
637,"Old Station Goods Yard, Warton Road, Carnforth, Lancs., United Kingdom, LA5 9EU",Private limited Company,18-Apr-19,68209 - Other letting and operating of own or leased real estate
638,"42a Pontardulais Road, Gorseinon, Swansea, Wales, SA4 4FE",Private limited Company,23-Apr-19,81221 - Window cleaning services
639,"15 Withybed Way, Newbury, Berkshire, United Kingdom, RG18 4DG",Private limited Company,23-Apr-19,62020 - Information technology consultancy activities
640,"16 The Hale, London, England, E4 9NS",Private limited Company,25-Apr-19,43330 - Floor and wall covering
641,"73 Folly Lane, Warrington, England, WA5 0ND",Private limited Company,25-Apr-19,56103 - Take-away food shops and mobile food stands
642,"36 Gafzelle Drive, Canvey Island, United Kingdom, SS8 7NA",Private limited Company,29-Apr-19,70221 - Financial management
643,"33 Pinnox Street, Stoke-On-Trent, Staffordshire, United Kingdom, ST6 6AH",Private limited Company,7-May-19,45111 - Sale of new cars and light motor vehicles
644,"Flat 1 Kelvin Court, Jasmine Grove, London, SE20 8JX",Private limited Company,8-May-19,41202 - Construction of domestic buildings
645,"40a Hinckley Road, Stoke Golding, Nuneaton, Warwickshire, England, CV13 6DU",Private limited Company,9-May-19,68209 - Other letting and operating of own or leased real estate
646,"498 Lichfield Road, Sutton Coldfield, England, B74 4EL",Private limited Company,13-May-19,74902 - Quantity surveying activities
647,"260 Lionel Road North, Brentford, England, TW8 9QU",Private limited Company,13-May-19,82990 - Other business support service activities not elsewhere classified
648,"27 Gidlow Lane, Wigan, England, WN6 7DP",Private limited Company,15-May-19,"47110 - Retail sale in non-specialised stores with food, beverages or tobacco predominating"
649,"The Beeches, 30 Bridge Street, Thetford, Norfolk, United Kingdom, IP24 3AG",Private limited Company,15-May-19,70229 - Management consultancy activities other than financial management
650,"6 Cornwall Close, Maidenhead, Berkshire, England, SL6 7TA",Private limited Company,16-May-19,41100 - Development of building projects
651,"9 Brooke Close, Southport, England, PR9 7TF",Private limited Company,16-May-19,43310 - Plastering
652,"18 Ashville, New Rossington, Doncaster, South Yorkshire, England, DN11 0BX",Private limited Company,20-May-19,39000 - Remediation activities and other waste management services
653,"1b Ferries Street, Hull, East Riding Of Yorkshire, England, HU9 1RL",Private limited Company,21-May-19,82990 - Other business support service activities not elsewhere classified
654,"4 Queens Road, London, SW19 8YB",Private limited Company,24-May-19,42120 - Construction of railways and underground railways
655,"8 Denny Gardens, Dagenham, United, England, RM9 4DD",Private limited Company,28-May-19,41100 - Development of building projects
656,"460 Rainham Road South, Dagenham, Essex, England, RM10 7XA",Private limited Company,28-May-19,70229 - Management consultancy activities other than financial management
657,"28 Leavesden Road, Watford, Hertfordshire, United Kingdom, WD24 5ED",Private limited Company,28-May-19,78109 - Other activities of employment placement agencies
658,"23 Centenary Way, Raunds, Wellingborough, Northants, United Kingdom, NN9 6UL",Private limited Company,28-May-19,68209 - Other letting and operating of own or leased real estate
659,"36 Northdene, Chigwell, United Kingdom, IG7 5JT",Private limited Company,29-May-19,41100 - Development of building projects
660,"Suite 5 Oldham Street, Atlantic House, Manchester, Lancashire, M4 1LW",Private limited Company,30-May-19,96020 - Hairdressing and other beauty treatment
661,"126 Gospel Lane, Acocks Green, Birmingham, Westmidlands, England, B27 7AD",Private limited Company,3-Jun-19,43341 - Painting
662,"Grangewood Huntick Road, Lytchett Matravers, Poole, Dorset, England, BH16 6BB",Private limited Company,3-Jun-19,41202 - Construction of domestic buildings
663,"38 Hoylake Road Hoylake Road, Wirral, Merseyside, England, CH46 9PB",Private limited Company,4-Jun-19,90020 - Support activities to performing arts
664,"5 Ebenezer Mussel House, Patriot Square, London, United Kingdom, England, E2 9NX",Private limited Company,6-Jun-19,64991 - Security dealing on own account
665,"C/O Ja Associates 1-4 The Parade, Monarch Way, Ilford, Essex, England, IG2 7HT",Private limited Company,10-Jun-19,62090 - Other information technology service activities
666,"Acklam Hall, Hall Drive, Middlesbrough, England, TS5 7DY",Private limited Company,11-Jun-19,82990 - Other business support service activities not elsewhere classified
667,"Access Self Storage Harborne Lane, Selly Oak, Birmingham, England, B29 6SN",Private limited Company,11-Jun-19,46900 - Non-specialised wholesale trade
668,"7 Keppel Street, Coventry, England, CV1 5HP",Private limited Company,11-Jun-19,98000 - Residents property management
669,"Unit 4 Stream Business Units, Wells, United Kingdom, BA5 1UH",Private limited Company,12-Jun-19,"45400 - Sale, maintenance and repair of motorcycles and related parts and accessories"
670,"10 Graham House Dunn Terrace, Byker, Newcastle Upon Tyne, England, United Kingdom, NE6 1AT",Private limited Company,13-Jun-19,43320 - Joinery installation
671,"26 Westmorland Close, London, United Kingdom, E12 5HS",Private limited Company,14-Jun-19,46410 - Wholesale of textiles
672,"Bristol House, Langley-On-Tyne, Hexham, United Kingdom, NE47 5LA",Private limited Company,17-Jun-19,47910 - Retail sale via mail order houses or via Internet
673,"5 Witham Close, St. Ives, England, PE27 3DY",Private limited Company,17-Jun-19,81210 - General cleaning of buildings
674,"3 Forge Street, Crewe, England, CW1 2DL",Private limited Company,18-Jun-19,68100 - Buying and selling of own real estate
675,"128 High Street, Crediton, Devon, United Kingdom, EX17 3LQ",Private limited Company,20-Jun-19,"43220 - Plumbing, heat and air-conditioning installation"
676,"1168 Melton Road, Syston, Leicester, England, LE7 2HB",Private limited Company,20-Jun-19,"47230 - Retail sale of fish, crustaceans and molluscs in specialised stores"
677,"Unit 13 Denmark Street, Newcastle Upon Tyne, United Kingdom, NE6 2XF",Private limited Company,21-Jun-19,98000 - Residents property management
678,"Flat 4 5 Devonshire Street, London, England, W1W 5DU",Private limited Company,21-Jun-19,43999 - Other specialised construction activities not elsewhere classified
679,"Kemp House, 160 City Road, London, United Kingdom, EC1V 2NX",Private limited Company,24-Jun-19,96090 - Other service activities not elsewhere classified
680,"377 Farnborough Road, 4 Cody Court, Farnborough, England, GU14 8AW",Private limited Company,24-Jun-19,46900 - Non-specialised wholesale trade
681,"48 Woods Avenue, Hatfield, England, AL10 8NA",Private limited Company,27-Jun-19,68100 - Buying and selling of own real estate
682,"38 Bishopsford Road, Morden, England, SM4 6AX",Private limited Company,28-Jun-19,46450 - Wholesale of perfume and cosmetics
